{
  "$schema": "identifiers.schema.json",
  "registryVersion": 1,
  "scope": {
    "roots": [
      ".agents",
      ".claude",
      ".codex",
      ".githooks",
      ".github",
      "android",
      "bot",
      "build",
      "deploy",
      "docs",
      "electron",
      "headless",
      "ios",
      "ip-refactor",
      "mediawiki",
      "public",
      "python",
      "scripts",
      "server",
      "src",
      "tests",
      "third_party"
    ],
    "files": [
      ".browserslistrc",
      ".dockerignore",
      ".env.example",
      ".gitattributes",
      ".gitignore",
      "admin.html",
      "AGENTS.md",
      "biome.json",
      "capacitor.config.ts",
      "CLAUDE.md",
      "CODE_OF_CONDUCT.md",
      "CONTRIBUTING.md",
      "CREDITS.md",
      "DEPLOY.md",
      "docker-compose.yml",
      "Dockerfile",
      "editor.html",
      "ELECTRON-DESKTOP-AUDIT.md",
      "GEMINI.md",
      "guide.html",
      "index.html",
      "LICENSE",
      "License.txt",
      "mediawiki/Dockerfile",
      "music_editor.html",
      "package-lock.json",
      "package.json",
      "play.html",
      "PRIVACY_POLICY.md",
      "README.md",
      "SECURITY.md",
      "svelte.config.js",
      "TERMS_AND_CONDITIONS.md",
      "THIRD_PARTY_NOTICES.md",
      "tsconfig.admin.json",
      "tsconfig.json",
      "vite.config.ts",
      "vitest.browser.config.ts"
    ],
    "pathRoots": [
      ".agents",
      ".claude",
      ".codex",
      ".githooks",
      ".github",
      "android",
      "bot",
      "build",
      "deploy",
      "docs",
      "electron",
      "headless",
      "ios",
      "ip-refactor",
      "mediawiki",
      "public",
      "python",
      "scripts",
      "server",
      "src",
      "tests",
      "third_party"
    ],
    "pathFiles": [
      "build-version-footer.png",
      "woc_community.png",
      "woc_logo_square.webp",
      "worldofclaude.png"
    ],
    "textExtensions": [
      ".cjs",
      ".css",
      ".cts",
      ".env",
      ".gradle",
      ".html",
      ".js",
      ".json",
      ".md",
      ".mjs",
      ".mts",
      ".pbxproj",
      ".plist",
      ".properties",
      ".py",
      ".sh",
      ".svelte",
      ".toml",
      ".ts",
      ".tsx",
      ".txt",
      ".webmanifest",
      ".xml",
      ".yaml",
      ".yml"
    ],
    "exclusions": [
      {
        "id": "identifier-registry-control-plane",
        "paths": [
          "docs/compatibility/IDENTIFIERS.md",
          "docs/compatibility/identifiers.registry.json",
          "docs/compatibility/identifiers.schema.json",
          "scripts/lib/identifier_compatibility.d.mts",
          "scripts/lib/identifier_compatibility.mjs",
          "scripts/verify_identifier_compatibility.mjs",
          "tests/identifier_compatibility_registry.test.ts"
        ],
        "justification": "The registry, schema, verifier, documentation, and their literal contract tests necessarily quote every controlled identifier. Their exact path inventory is locked here to prevent the exclusion from growing silently.",
        "expectedPathCount": 7,
        "pathInventorySha256": "854772c7619a72c2b487c4067769354b223fe6c38d945ebda574f3eee2ecb3d5"
      }
    ]
  },
  "detectors": [
    {
      "id": "world-of-claudecraft-label",
      "target": "content",
      "kind": "literal",
      "expression": "World of ClaudeCraft",
      "flags": "i",
      "description": "Full player-facing project title."
    },
    {
      "id": "claudecraft-label",
      "target": "content",
      "kind": "regex",
      "expression": "(?<!World of )ClaudeCraft",
      "flags": "i",
      "description": "Short project title outside the full title."
    },
    {
      "id": "worldofclaudecraft-slug",
      "target": "both",
      "kind": "regex",
      "expression": "worldofclaudecraft",
      "flags": "i",
      "description": "Unqualified compact project slug used in repository and technical identities."
    },
    {
      "id": "woc-token",
      "target": "content",
      "kind": "regex",
      "expression": "\\$WOC\\b|\\bWOC\\b",
      "flags": "",
      "description": "Standalone WOC brand or token symbol."
    },
    {
      "id": "woc-infrastructure-name",
      "target": "content",
      "kind": "regex",
      "expression": "\\bwoc(?:[-/][a-z0-9_.-]+)+",
      "flags": "i",
      "description": "Lowercase woc-prefixed service, installed path, and container asset identities.",
      "paths": ["Dockerfile", "mediawiki/Dockerfile", "docker-compose.yml", "deploy/**/*"]
    },
    {
      "id": "woc-delimited-technical",
      "target": "content",
      "kind": "regex",
      "expression": "\\bwoc(?:[-/][a-z0-9_.-]+)+",
      "flags": "i",
      "description": "Catch-all woc- and woc/ technical namespaces outside dedicated infrastructure files.",
      "excludePaths": ["Dockerfile", "mediawiki/Dockerfile", "docker-compose.yml", "deploy/**/*"]
    },
    {
      "id": "levy-street",
      "target": "content",
      "kind": "literal",
      "expression": "Levy Street",
      "flags": "i",
      "description": "Levy Street organization or attribution name."
    },
    {
      "id": "claudemoon",
      "target": "content",
      "kind": "regex",
      "expression": "\\bClaudemoon\\b",
      "flags": "i",
      "description": "Claudemoon realm identifier and its visible rendering."
    },
    {
      "id": "claudemoon-grant-id",
      "target": "content",
      "kind": "literal",
      "expression": "champion_of_claudemoon",
      "flags": "",
      "description": "Persistent hidden grant ID derived from the Claudemoon realm name."
    },
    {
      "id": "eastbrook-display",
      "target": "content",
      "kind": "regex",
      "expression": "\\bEastbrook(?: Vale)?\\b",
      "flags": "",
      "description": "Eastbrook player-facing place label."
    },
    {
      "id": "eastbrook-technical",
      "target": "both",
      "kind": "regex",
      "expression": "\\beastbrook(?:[-_][a-z0-9_-]+)?\\b",
      "flags": "",
      "description": "Lowercase Eastbrook identifiers not proven to be display-only."
    },
    {
      "id": "eastbrook-docker",
      "target": "content",
      "kind": "regex",
      "expression": "\\beastbrook(?:-(?:db|game|discord-bot|wiki(?:-db)?)|_(?:pgdata|wikidb|wiki_images))\\b",
      "flags": "",
      "description": "Docker service, container, and volume names in the Eastbrook deployment family."
    },
    {
      "id": "eastbrook-database-config",
      "target": "content",
      "kind": "regex",
      "expression": "(?:POSTGRES_(?:USER|DB)[:=]\\s*eastbrook|(?:psql|pg_dump)\\s+-U\\s+eastbrook\\s+eastbrook|postgres(?:ql)?://eastbrook)",
      "flags": "i",
      "description": "PostgreSQL user, database, and connection identities for Eastbrook."
    },
    {
      "id": "eastbrook-filesystem",
      "target": "content",
      "kind": "literal",
      "expression": "/opt/eastbrook",
      "flags": "",
      "description": "Installed Eastbrook filesystem root."
    },
    {
      "id": "claudium",
      "target": "content",
      "kind": "regex",
      "expression": "\\bClaudium\\b",
      "flags": "i",
      "description": "Claudium economic balance, purchase, and presentation identifier."
    },
    {
      "id": "armory",
      "target": "content",
      "kind": "regex",
      "expression": "\\bArmory\\b",
      "flags": "i",
      "description": "Armory store, weapon-skin ownership, and presentation identifier."
    },
    {
      "id": "woc-client-storage-key",
      "target": "content",
      "kind": "regex",
      "expression": "\\bwoc_(?:site_visitor_id|editor_(?:autosave|draft|drafts_index|server_links|map|maps|maps_index|tutorial_seen|playtest)|session|seed|gamepad|keybinds|haptics_on|perf(?:_session_id|_overlay)?|settings|cached_stats|discord_(?:choice|cta_dismissed|onboard)|homepage_music_muted|last_realm|spawn_intro_seen|native_discord_verifier|bag_filter|bank_filter|deed_watch|lfg_intent|layout_reset_epoch|player_frame_pos|target_frame_pos|chat_(?:active_tab|geometry|tabs)|emote_wheel_|hotbar_|ignored_chat_names|mobile_chat_bottom|native_auto_locale|party_collapsed|theme)(?=$|[^a-z0-9_])",
      "flags": "",
      "description": "Known localStorage and sessionStorage key families."
    },
    {
      "id": "woc-lower-technical",
      "target": "content",
      "kind": "regex",
      "expression": "\\bwoc_[a-z0-9_:-]+",
      "flags": "",
      "description": "Catch-all lowercase woc_ technical identifier family requiring explicit review."
    },
    {
      "id": "woc-network-header",
      "target": "content",
      "kind": "regex",
      "expression": "\\bx-woc-[a-z0-9-]+\\b",
      "flags": "i",
      "description": "HTTP headers in the x-woc-* namespace."
    },
    {
      "id": "woc-network-route",
      "target": "content",
      "kind": "regex",
      "expression": "/api/woc/[a-z0-9_./?=&${}-]+",
      "flags": "i",
      "description": "HTTP routes in the /api/woc/* namespace."
    },
    {
      "id": "claudium-network-route",
      "target": "content",
      "kind": "regex",
      "expression": "/(?:api|v1)/claudium[a-z0-9_./?=&${}-]*",
      "flags": "i",
      "description": "Internal and upstream Claudium HTTP routes."
    },
    {
      "id": "oauth-callback-route",
      "target": "content",
      "kind": "regex",
      "expression": "/(?:api/auth/(?:discord|github)[a-z0-9_./?=&${}-]*|oauth/(?:authorize|token|revoke|device_authorization|device)[a-z0-9_./?=&${}-]*)",
      "flags": "i",
      "description": "OAuth endpoints and callbacks whose deployed values must remain coordinated."
    },
    {
      "id": "woc-metric",
      "target": "content",
      "kind": "regex",
      "expression": "\\bwoc_(?:accounts_online|characters_created_total|chat_messages_total|client_fps|client_frame_p95_seconds|client_long_frames_rate|player_[a-z0-9_]+|players_online|sim_[a-z0-9_]+|ws_[a-z0-9_]+)\\b",
      "flags": "",
      "description": "Prometheus and client-performance metric names."